title,score,url,num_comments,body,created
that's my UAlberta :'),1097,https://i.redd.it/mh7v2l10ckk51.jpg,26,,2020-09-01 10:27
I got the last croissant.,930,https://www.reddit.com/r/uAlberta/comments/10dllm3/i_got_the_last_croissant/,61,"You know who I am. You stood mere inches behind me in line the CAB quick serve Tim's (despite my attempts to create space between us and you moving up closer every time), complaining the entire time that you were going to be late to class despite getting in line after 11 am. You complained the whole time about how slow they were moving, and that you had somewhere to be. For 10 full minutes everyone around you listened to you complain about how ridiculous it is that the employees have kept you waiting despite the fact that you have a class to be in.

Your mistake was saying, out loud and clear to everyone, ""I really want a croissant"". There was one left. I didn't want a croissant but I knew what I had to do.

Your complaints about how terrible the service is is not nearly as funny or endearing as you seem to think. It is frustrating that service slows down around class breaks, but it was your decision and yours alone to get coffee despite the fact that you had somewhere to be. These people are working for a living and THEY are the reason you get to bring Tim's to class with you. Maybe practicing a bit of patience and time management would be of benefit to you. Was this an asshole move? Most definitely. I don't need judgement there, I know it was unecessary and petty. But as someone who has worked enough minimum wage service jobs, it's not the difficult to recognize when being petty is appropriate.

And by the way? The croissant was delicious.",2023-01-16 10:42
Every upper level Student in their 100 level option classes,892,https://i.redd.it/dvetvv73rpc61.jpg,31,,2021-01-21 09:36
400 upvotes and we will put a cowboy hat on the CCIS dinosaur,830,https://www.reddit.com/r/uAlberta/comments/fmvbl6/400_upvotes_and_we_will_put_a_cowboy_hat_on_the/,20,u/riverbendr promised to do it,2020-03-22 00:20
Hmmm,750,https://i.redd.it/o615fqs8oom41.jpg,11,,2020-03-14 12:42
FUCK YOU FUCK YOU FUCK YOU FUCK YOU FUCK YOU FUCK YOU,744,https://i.redd.it/6m777aqz9lna1.jpg,203,,2023-03-13 12:14
Top 10 reasons why this semester has been awesome,741,https://v.redd.it/o0wv7mf52w141,27,,2019-11-30 14:06
How this year's been going,698,https://i.redd.it/4r0aw0jy6hu41.png,10,,2020-04-22 20:07
upvote if you've got zero work done in the weekend,694,https://www.reddit.com/r/uAlberta/comments/dhpsab/upvote_if_youve_got_zero_work_done_in_the_weekend/,37,,2019-10-14 06:21
"Room 10-241, DICE.",687,https://i.redd.it/nc0vswi5xla41.jpg,8,,2020-01-13 13:37
Attention!!A Chinese student was attacked in University Station.,683,https://www.reddit.com/r/uAlberta/comments/myji8a/attentiona_chinese_student_was_attacked_in/,128,"We need more attention in this case, and give this guy some help!!!!

**I am not the victim, please go to the original post and share it. Let the government and media know. We need people's attention in this case, it is horrible!!!!**

RE:  Last night at 9:25pm, I was attacked by a crazy stranger with a knife on the Univeristy Station platform. While I took the train from Corona station to Univeristy station, the stranger he came to sit down next to another guy and me. He thought he had asked me some questions. In fact, he never asked me anything. He then followed me when I got off at the Univeristy Station. Next to the train door, he assaulted me and punched my face. I defended myself, he then stabbed my arm with a knife. The LRT driver stopped the train when other passengers were aware of the offence happned on the Univeristy station platform. However, passengers did not offer me any help to contact police and ambulance. Even though the guy had already escaped from university station escalator, a group of train passengers stopped others who were inclined to get off train from helping me, saying “it is his problem”. After the LRT train and other passengers left, I pressed the emergency button on the Univeristy station platform to wait for help. The Univeristy of Alberta Protective Service (UAPC) office is located in education building, which is 15 minutes walk from the train station, but I waited about 15-20 minutes to have the city police arrived instead of those UAPC. Shame for humanity, public security of the City of Edmonton and the Univeristy of Alberta campuses.

I have been studying at the Univeristy of Alberta since Spetmber 2015, and I will graduate from my Bachelor of Commerce Cooperative Education Program this summer. As an international student, I have a stong sense of belonging with University of Alberta and regard City of Edmonton as my second home. I feel so disappointed to experience this horrible incident and realized how fragile the humanity could be facing challenges. I do not deserve what happened, the horrible thing should not happen to other people in the communities of University of Alberta, and City of Edmonton! It is more disappointing that I might not never know the charge on that person who attacked me with his knife and was caught by city police, unless the case is dealt by public prosecutors. I chose not to tell this incident to my parents as I do not make them worry about me in China. I decided to let the public know for the awareness that how dangerous it can suddenly be when you had trust for your communities. More ironically, I am interning at the TransEd LRT partners to support the public-private partners in the operation and maintenance functions of Valley Line Southeast project in the City of Edmonton.

University of Alberta University of Alberta Students' Union - UASU International Student Services, University of Alberta City of Edmonton CBC Edmonton

&#x200B;

ORIGINAL POST:  [https://www.facebook.com/profile.php?id=100009628610218](https://www.facebook.com/profile.php?id=100009628610218)

Warning， the original post has some pictures contained blood that may let you feel uncomfortable.",2021-04-25 16:39
i still have 2 more exams to do :(,661,https://i.redd.it/g0j5ufd2a9561.jpg,38,,2020-12-14 18:47
JUST GOT MY FIRST A+ !!!,649,https://i.redd.it/ol2myasxzt661.png,48,,2020-12-22 17:28
Confusing first years part 2,650,https://i.redd.it/cln56plmjyh61.jpg,32,,2021-02-16 20:31
final exam day and eclass is down,624,https://i.redd.it/ako1g1q6km461.jpg,33,,2020-12-11 14:20
Tfw when you dont have to go to campus for 5 1/2 months,620,https://i.redd.it/r3nmog57o3n41.jpg,4,,2020-03-16 15:09
Congrats to Prof. Michael Houghton for winning the Nobel Prize!,615,https://www.reddit.com/r/uAlberta/comments/j5hrmq/congrats_to_prof_michael_houghton_for_winning_the/,11,[https://www.theglobeandmail.com/canada/article-canadian-virologist-michael-houghton-jointly-wins-nobel-prize-for/](https://www.theglobeandmail.com/canada/article-canadian-virologist-michael-houghton-jointly-wins-nobel-prize-for/),2020-10-05 05:34
"Heeyyyy guys. Upcoming first year pre-med, pre-dent, pre-law, and engg student here. Does this schedule seem doable? I work part time as well.",602,https://i.redd.it/syq22nba4nt81.png,52,,2022-04-15 00:55
U of A Profs go hard,598,https://i.redd.it/0u1yt7fnv3u51.png,18,,2020-10-19 13:48
It's truly magical,596,https://i.redd.it/evniox2b3ir41.jpg,13,,2020-04-07 19:55
🥺🥺,587,https://i.redd.it/1iva8cc0kev41.jpg,14,,2020-04-27 12:18
it be like that,593,https://i.redd.it/fkhnq6w7lum41.jpg,0,,2020-03-15 08:36
Photo of me giving my 360° room tour for SEM,587,https://i.redd.it/59kbfaxj37g61.png,11,,2021-02-07 23:11
upvote if u got zero work done in the long weekend,586,https://www.reddit.com/r/uAlberta/comments/j9pnx2/upvote_if_u_got_zero_work_done_in_the_long_weekend/,13,yep,2020-10-12 06:05
Took this pic today. Some things never change.,583,https://i.redd.it/b9y2tvxygkr51.jpg,21,,2020-10-06 18:24
Yo wtf is going on,576,https://i.redd.it/bj6n4hg2n9o41.jpg,10,,2020-03-22 12:17
PSA: not everyone who is for CR/NCR is a piece of shit who didn't work hard,582,https://www.reddit.com/r/uAlberta/comments/flnvmq/psa_not_everyone_who_is_for_crncr_is_a_piece_of/,58,"Okay ualberta reddit hear me out...

I get that you're angry and upset and scared. Me too. It's been a long semester and we've been working our asses off towards goals that many of us have dreamt about since we were children 

BUT that doesn't mean that we get to be cruel and quick with our judgement. We have literally no idea what some people are going through because of this right now. 

For a second let's just put aside the very lucky students who live in Edmonton with their families and get to ride this out from the comfort of their bedroom with their family all safe and sound with them. 

I want you to consider the students who have came from far away, both domestic and international, who in the last week have had their entire lives uprooted. In the middle of this many have faced immense pressure to return home to their families. If you live at home I want you to think about this for a second: in the next five days you have to completely pack up your entire life, tie up all of your loose ends, find a place to live for when you return (maybe summer, maybe September, who knows at this point), oh and by the way classes are still happening so good luck catching up. 

I want you to consider the people who are under intense financial stress, because that majorly affects things. I know people who have lost coop jobs or other summer work placements they were depending on to pay for school. I know people who's parents have been laid off and are being asked to contribute financially. I know these are things that can be dealt with, but it is just more added stress in the middle of an already stressful experience (which definitely negatively affects academic performance) 

I want you to think of students who have kids, who are now scrambling to care for a child on top of going to school. I know people are saying you can work from home and take care of your kid and I don't know how much you know about toddlers, but I can tell you that a three year olds tantrum does not give a fuck that you're trying to write an online exam. 

I know that it's hard to accept that some people who haven't really worked that hard are going to slip through this semester, but don't you dare tell me that all of the people who will benefit from this didn't work hard. This virus has affected mass amounts of students in unimaginably stressful ways, and, if no measures are taken, will negatively impact academic achievement for people who aren't lucky enough to have the ideal situation. This isn't even taking into account the students who will get sick or have loved ones get sick. 

I'm not saying it's the best option, I'm just saying that telling people they are a piece of shit who just wants to cheat on their finals is kinda not cool. 

Let's try and keep loving each other my dudes, even though the world is a lil scary rn. 

(Sorry what I'm sure is an abundance of bad grammar, but quite frankly I don't give a fuck)",2020-03-19 21:27
Online classes be like,574,https://i.redd.it/g3olwhif9eo51.jpg,0,,2020-09-20 18:19
Saw this today.. big yikes,567,https://i.redd.it/0zclvfdeobt51.jpg,45,,2020-10-15 14:58
A small peek at Fall 2021,563,https://i.redd.it/jz9jwmalf2w61.jpg,32,,2021-04-29 01:34
Friendly reminder to always shoot your shot. The worst thing they can say is “no”.,562,https://i.redd.it/v81im44nqm661.jpg,48,,2020-12-21 17:04
Engineering students who studied online in 2020,556,https://i.redd.it/zpzvbf95b9q41.jpg,15,,2020-04-01 13:19
Upvote to confuse first years,556,https://i.redd.it/3h1axbff7sh61.jpg,20,,2021-02-15 23:12
Guba appreciation,553,https://i.redd.it/dw2lc60y7jp91.jpg,8,,2022-09-22 21:59
Oh no,553,https://i.redd.it/nrtqnyqbail41.jpg,21,,2020-03-08 14:09
Can I report a prof for lying during a lecture?,546,https://www.reddit.com/r/uAlberta/comments/mn4s3s/can_i_report_a_prof_for_lying_during_a_lecture/,15,"She said ""Good Morning"" when it wasn't.

This is completely unacceptable.",2021-04-08 17:49
Finally got all my grades back!!! Degree completed!!,542,https://i.redd.it/hcpocfkyw4b61.jpg,35,,2021-01-13 10:28
Stolen,539,https://i.redd.it/mgn9xrxmtq651.jpg,14,,2020-06-23 17:19
Overheard in my class,519,https://www.reddit.com/r/uAlberta/comments/djfv1a/overheard_in_my_class/,17,"Dude 1: Hey man, do you have the notes from last class? I wasn't here.

Dude 2: We had a midterm last class.

Dude 1: \*utter shock\*",2019-10-17 19:05
I will Run for SU President; here is my platform,520,https://www.reddit.com/r/uAlberta/comments/sljnqz/i_will_run_for_su_president_here_is_my_platform/,31,"1. Get a Costco business card to purchase better quality toilet paper for cheap
2. Lay on the floor outside of the University President's office and kick the door repeatedly until he caves into student demands
3. Deputize the campus geese into UAPS
4. Put a different hat on Dr. Dino Hinshaw every week (p.s. I was the person who suggested Indiana Bones, so you know I have good taste)
5. Release feral cats into the offices of professors who have bad URSIs or Rate my Professor GPAs
6. Free girlfriends for the campus incels
7. Personally patrol the LRT between South Gate and Churchhill from 9-5pm and karate chop any one who harasses a U of A student (Grant Macewaner's are on your own unless you elect me to SU president at your school as well)
8. Bring 10 McDonald's onto campus, but they're all in the Mazankowski Heart Institute for maximum irony
9. Demolish all pedways and build a rollercoaster to take you between buildings instead
10. Replace the bear statue outside of VVC with a real bear
11. Open a second gym called ""Handsome Fitness Center""; you can only go there if you're a certified 9/10+ in looks (great personalities need not apply)
12. Speaking of gyms, I will get airport style security + a coatcheck style service for the current VVC locker rooms to prevent thefts
13. Bring realistic opportunities to the Career fair like Starbucks, Patreon, and Onlyfans
14. Replace the mural on the Education building with a painting of a U of A COVID update email
15. Cancel student insurance (sorry, too risky, live bear on campus)
16. Refund everyone $25 for the ""SUB Renovation Fee"" by opening a personal onlyfans and an onlyfans for u/riverbendr's feet; extra cash will be donated toward daycare for students who are parents
17. Mail international students abroad a personal care package of whatever coffee they like from campus
18. You know those community book-swap libraries where you leave a book/take a book? That, but for degrees
19. Burn down the forest behind campus (not related to the SU; just feeling lit rn)

VOTE FOR ME.",2022-02-05 16:16
Mmm yes get it,521,https://i.redd.it/44wcakl0ahb41.jpg,6,,2020-01-17 23:05
Upvote for good luck. Good luck to all those writing midterms next week.,522,https://i.redd.it/w5vhyccwkfp31.jpg,12,,2019-09-28 18:51
University of HONK,521,https://i.redd.it/tfwyqh6x1uu41.jpg,16,,2020-04-24 15:21
Golden Bears goalie Matt Berlin is currently playing for the Edmonton Oilers,518,https://i.redd.it/0moc6xqxoyea1.jpg,25,,2023-01-28 22:45
"Last semester I got close with 4... my graduating semester, I finally managed 5 😊",518,https://i.redd.it/rvlik8zm9lw61.png,66,,2021-05-01 16:55
In case you needed confirmation that professors read this subreddit..,514,https://i.redd.it/x464vz71msxb1.jpg,47,This was put up before Dr. Harris started his lecture today for Bio 108. Kind of hilarious 🤣,2023-11-01 14:04
I finally graduated after 8 years!,505,https://www.reddit.com/r/uAlberta/comments/gc0vdd/i_finally_graduated_after_8_years/,41,"Started school in 2012, got rejected into the bcom program 2 years in a row, took time off due to mental illness as an aftermath , got my shit together, came back, got into bcom and today i received my final CR and have officially graduated from the bcom program! I dont have a convocation to share this feeling with but i will happily share it with this subreddit! i did it!",2020-05-01 23:09
Too Relatable...,510,https://i.redd.it/dmm2u2kkl9s41.jpg,7,,2020-04-11 16:27
Pressing the wrong button on beartracks during enrollment,502,https://i.redd.it/z416ebvqzvy61.jpg,9,,2021-05-13 07:07
...but will it crash again?,501,https://i.redd.it/c60o7pncwpk51.jpg,3,,2020-09-02 05:10
When you realize you have an exam in 24hours that you haven't studied for because you have been “taking care” of your mental health since March 17th.,500,https://i.redd.it/vh9915a9vfs41.jpg,13,,2020-04-12 13:30
Bruh how TF yall so scared of a virus named after an LRT station lmaooo,501,https://www.reddit.com/r/uAlberta/comments/eud6yq/bruh_how_tf_yall_so_scared_of_a_virus_named_after/,20,This post was brought to you by Bay Enterprise Square station gang,2020-01-26 14:23
All this CR/NCR talk has given me PTSD from a dark period of this subreddit...,499,https://i.redd.it/a7ipboos37361.jpg,38,,2020-12-04 09:17
If you stole my backpack from my locker (7th floor Katz),493,https://www.reddit.com/r/uAlberta/comments/etlai1/if_you_stole_my_backpack_from_my_locker_7th_floor/,32,"If you are the person who stole my black backpack from my locker in Katz today, I don't care about the computer or anything that you deem valuable. I just ask that you find a way to return all of my research thesis data. There should be some spreadsheets printed off in a clear folder. I spent the last 5 months collecting this data from 30 mice that have now been euthanized and this data is vital for my research course. If you drop off the papers somewhere on campus and let me know anonymously, I will be forever grateful.

If anyone else sees some spreadsheets in the garbages or recycling bins on campus, I'd ask that you send me a quick pm so I can check them out.",2020-01-24 20:12
Love bonding with your prof over a mental breakdown...,495,https://i.redd.it/5uah6tf4pyj61.png,19,,2021-02-26 23:10
My Professors are like I would like to add more headache to this difficult time :(,495,https://i.redd.it/cwca6i2w2dt51.jpg,9,,2020-10-15 19:41
School in Minecraft > Normal school > School on zoom,501,https://i.redd.it/clfdxwr13wq41.jpg,21,,2020-04-04 17:54
Only 3 more weeks..,490,https://i.redd.it/105yf1x36fq61.jpg,4,,2021-03-31 13:59
90% of the faculty of science lmaoo,488,https://i.redd.it/mrkas7hqqhj41.jpg,46,,2020-02-27 09:11
Are you depressed?,487,https://www.reddit.com/r/uAlberta/comments/ewk7av/are_you_depressed/,57,Upvote if you depressed im tryna see something,2020-01-30 23:31
Our boi officially has a name,484,https://i.redd.it/rnrzpoi2igt41.jpg,21,,2020-04-17 16:42
When you have two exams in one day,482,https://i.redd.it/mciww8pzi4t21.png,6,,2019-04-18 19:29
@theUofA,485,https://i.redd.it/4dkr9mtgkpp41.jpg,12,,2020-03-29 18:55
I neglected my son this semester to focus on classes and got a message on my transcript.,479,https://i.redd.it/ldgcs28harx61.png,9,,2021-05-07 14:14
Me IRL,482,https://i.imgur.com/rzeXCjY.jpg,8,,2020-12-01 22:41
Mods pls. I can't post memes to MegaThread,486,https://i.redd.it/ax08hn9r2em41.jpg,21,,2020-03-13 01:04
Where are these new modules coming from...,481,https://i.redd.it/hmnzhncvuju51.jpg,9,,2020-10-21 19:32
They had me in the first half,479,https://i.redd.it/jzdxnlywm7b71.jpg,5,,2021-07-14 11:06
At least it's better than clowning in the chat box,475,https://i.redd.it/n1i0szsrqdl51.jpg,14,,2020-09-05 13:22
The last time math truly made sense,473,https://i.redd.it/k9avj0pnlo241.jpg,16,,2019-12-04 14:05
ATTENTION EVERYONE: We have nothing new to report.,474,https://i.redd.it/fch7lte52mq61.png,12,,2021-04-01 13:09
"I used to think that my grades were a tragedy, but now I realize, they're a comedy",475,https://i.redd.it/20lqg5zugxv31.jpg,14,,2019-10-31 13:25
Appreciate Professors like these,474,https://i.redd.it/5vd2epntw3p61.jpg,26,,2021-03-24 23:03
If only there was some way this could've been avoided...,474,https://i.imgur.com/8LS4hQO.png,15,,2020-03-13 08:35
Humanities Garbage Can Shot From 4th Floor,472,https://v.redd.it/bh1tp7jfu5t81,42,,2022-04-12 14:48
Finals are over ❤️,465,https://i.redd.it/8upkqfagx2wa1.jpg,18,,2023-04-25 13:09
Choked during SEM exam,469,https://www.reddit.com/r/uAlberta/comments/kfxdp4/choked_during_sem_exam/,15,"There I was under immense stress jumping from question to question when my dumb ass tried to flip the chewing gym 360 with my tongue which shot it straight down the back of my throat. I struggled for like 40 seconds before I finally forced myself to swallow it. 

Sad thing is it wasn't death that I feared, it was being suspected of cheating.

Though times, man, tough times.",2020-12-18 17:26
It really do be like that sometimes,466,https://i.redd.it/f04otbt67wk31.jpg,9,,2019-09-05 21:24
First time I've seen someone use the treadmill desk,466,https://i.redd.it/starmodofu2a1.jpg,20,,2022-11-28 19:36
The state of this sub rn,468,https://i.redd.it/f2f1vcy9ino41.gif,7,,2020-03-24 10:56
"If you know, you know",460,https://i.redd.it/u1nrimy48ig61.jpg,8,,2021-02-09 12:34
The leaves about to fall like my grades🍂😎,461,https://www.reddit.com/gallery/xxgdoi,10,,2022-10-06 15:08
Finally got some news regarding classes,461,https://i.redd.it/uf2zmgvrby981.png,18,,2022-01-05 16:13
Walking up the LRT stairs in September be like...,458,https://i.redd.it/yyrngj2u4bo61.jpg,6,,2021-03-20 22:17
how many assignments have you done so far?,456,https://i.redd.it/s3q6li7vlpo51.jpg,18,,2020-09-22 08:28
just wrote one sentence for my term paper. time to take a break for the next 24 hours,453,https://i.redd.it/u3d4syez1up41.jpg,7,,2020-03-30 10:01
Upvote if you haven't gotten anything done so far,457,https://www.reddit.com/r/uAlberta/comments/dvjkn2/upvote_if_you_havent_gotten_anything_done_so_far/,35,"Been playing Death Stranding nonstop, got 3 midterms after reading week and an English essay due which I haven't started. :(",2019-11-12 17:39
Excuse the terrible editing,446,https://i.redd.it/pz1mw4v7g1851.jpg,8,,2020-06-30 06:07
When the uni says they strongly encourage no finals but all of your classes still have finals.,452,https://i.redd.it/e932sw19r9p41.jpg,9,,2020-03-27 13:45
When you're writing a final and you start dissociating,451,https://i.redd.it/ddivp58seau21.png,7,,2019-04-24 16:20
Closing eclass at the end of the day,452,https://i.redd.it/vzw95neuei061.jpg,5,,2020-11-20 20:06
Last fall semester I posted that I had adopted a handsome lil tigger. I'm happy to announce that a year later Walter is thriving! He wishes you all the best on your studies 🧡🐈,456,https://i.redd.it/fr6km71kvml51.jpg,26,,2020-09-06 20:04
Need more profs like this 🥺,448,https://i.redd.it/qodrchqa83n51.jpg,30,,2020-09-14 04:09
why is this allowed?,451,https://i.redd.it/avtpi9do8s661.jpg,29,,2020-12-22 11:34
It be like that sometimes,445,https://i.redd.it/d1bduv09pw241.jpg,17,,2019-12-05 17:20
Online Classes Fall 2020 BearTracks Schedule Leaked - Can't Wait!,439,https://i.redd.it/b0svuh8i4mn41.jpg,9,,2020-03-19 05:12
Rest in peace to U of A student and alumnus Saba and Sara Saadat.,443,https://www.reddit.com/r/uAlberta/comments/elvp2t/rest_in_peace_to_u_of_a_student_and_alumnus_saba/,3,"Two of Edmonton's brightest lost in the plane crash, along with the professors.

Please comment below if there is a site or something set up yet to raise funds for the victims' families.",2020-01-08 10:20
"In grade 12 I failed 3 diplomas. After taking a gap year for personal growth, I completely turned my life around.",439,https://i.redd.it/2pxwrxbh5a471.png,49,,2021-06-09 12:04
The semester's finally over my dudes,438,https://i.redd.it/y20u3kj5bgw41.jpg,6,,2020-05-02 19:16
Confusing the first years even more!,441,https://i.redd.it/2nxhdug04tj61.png,16,,2021-02-26 04:23
Good luck everyone :),438,https://i.redd.it/fm1uc2j2zbs31.jpg,8,,2019-10-13 09:56
Taking the bus home as if it were another ordinary day... not knowing it'd be the last time for awhile,437,https://i.redd.it/x284lb64ety41.jpg,15,,2020-05-14 17:24
No title,438,https://i.redd.it/swdhdb2i9ch41.png,8,,2020-02-16 12:38
every friggin time,433,https://i.redd.it/isbmk87svre61.jpg,0,,2021-01-31 18:55
"Go girl, give us nothing",430,https://i.redd.it/xifmfhc4d5p51.jpg,19,,2020-09-24 13:27
