title,score,url,num_comments,body,created
Plz tell me how brave I am,258,https://www.reddit.com/r/uAlberta/comments/16y4x8z/plz_tell_me_how_brave_i_am/,25,"I was soooooo close to calling in sick for both my classes today… Not actually cause I'm sick, but I'm just tired and depressed. BUT I DIDNT!! I forced myself to be miserable and sit through 6 hours of classes. Sooo not to toot my own horn but I think I deserve a little treat for being so brave",2023-10-02 12:53
my schedule looks like a heart,258,https://i.redd.it/qs7t6ftxdqua1.png,28,,2023-04-18 17:55
Lmao GUBA got destroyed,261,https://i.redd.it/p9t4t7kn3nt91.jpg,12,,2022-10-13 15:18
Am I the only one who doesn't really want to go in-person this late into the semester.,259,https://www.reddit.com/r/uAlberta/comments/t0jc8h/am_i_the_only_one_who_doesnt_really_want_to_go/,39,"It's like, I'm already in a comfortable rhythm, why disrupt it with 1 month left in the semester.",2022-02-24 12:35
"Merry Xmas to all, from Chip!",258,https://i.redd.it/9lwj7z9c7e761.jpg,5,,2020-12-25 13:26
This point in the semester,260,https://i.redd.it/1q0qrz9g2st51.jpg,3,,2020-10-17 22:05
Wow our university has a weird way of congratulating graduates.,257,https://i.redd.it/navtkoghlh451.png,13,,2020-06-12 08:11
My Prof's Rules For Video Chats,256,https://i.redd.it/75kp1oujfon41.jpg,12,,2020-03-19 12:59
Petition to pay Khan Academy Tavid Durpin's salary,257,https://i.redd.it/u6d2mu9eo8h41.jpg,5,,2020-02-16 00:34
"Win or lose, we booze",255,https://i.redd.it/diw8zu7yhb441.jpg,4,,2019-12-12 20:09
To the TA who ends up marking my final,260,https://www.reddit.com/r/uAlberta/comments/e986l9/to_the_ta_who_ends_up_marking_my_final/,16,Sorry,2019-12-11 08:02
"""Its my lunch bag""",257,https://i.redd.it/nt5sdqxjnjn21.png,14,,2019-03-21 15:56
First 10 minutes of the MATE 202 Midterm,258,https://i.redd.it/aq5donvusqj61.jpg,5,,2021-02-25 20:39
Sai Yiu says f*ck you,258,https://i.redd.it/xd31qkoawbq41.jpg,55,,2020-04-01 22:01
Some cool old photos of the university!,254,https://archive.org/details/uaa-1969-097-679b,12,,2023-04-10 19:13
Not even Patches can catch a break,256,https://i.redd.it/3f69qhds006a1.jpg,7,,2022-12-14 17:35
How I imagine my gpa glow up Fall 2021 vs Winter 2022,255,https://v.redd.it/2t3n2evb07581,7,,2021-12-12 16:03
Aurora from campus at 2 AM,259,https://www.reddit.com/gallery/qmg0j3,9,,2021-11-04 02:23
anxiety and pain,256,https://i.redd.it/cubg3cbhd2761.jpg,3,,2020-12-23 21:41
Does anyone's cat sleep in their school bag like this?,257,https://i.redd.it/wjrt8kwzl8661.jpg,4,,2020-12-19 17:33
Aaaaaaaaaahhhh!,257,https://i.redd.it/2buhajbfwxv51.jpg,7,,2020-10-28 19:52
"When the prof says ""get the notes from one of your classmates""",257,https://i.redd.it/aoohn332qhu31.png,3,,2019-10-24 07:24
Midterm Season be like,253,https://i.redd.it/kad45q3foet31.jpg,4,,2019-10-18 20:06
Among Us costume in CCIS,256,https://www.reddit.com/r/uAlberta/comments/qihatb/among_us_costume_in_ccis/,14,"To whoever was just walking through CCIS in a full inflatable crew member costume, thank you, you made my day",2021-10-29 10:58
"please don't mind me, I'm trying my best ._.",253,https://i.redd.it/tk0xhbcilcr71.jpg,9,,2021-10-03 20:53
Open Letter to All Students💕,255,https://www.reddit.com/r/uAlberta/comments/kgbb94/open_letter_to_all_students/,27,"Dear person reading this:

You made it! 2020 was a long, confusing and difficult year but despite all of that, you are here! You made it through exams and you can finally take a breath and relax. If your grades aren't what you're used to, THATS OK, you've had to learn an essentially new way to study and prepare for every exam. You tried your best and that is something to be proud of. 

If no one else says it, I AM PROUD OF YOU. You are so strong and you've made it so far. That is no easy feat and you should cut yourself some slack. You did it. 

It's true that not everyone is in the same boat during this crazy time; some of us have yachts and jet boats, some of us have rowboats, some of us have life preservers, and some of us are drowning. But whatever you're situation has been, you've made it here. You've pushed past all the obstacles to get here and you know what? You. Did. It. 

Bad things happen and you can't do anything to change the past, so if you're still beating yourself up about not achieving something this year, don't. Don't let the past define who you are and who you want to be. Take this year and learn from it and kick even more ass next semester/year. 

You are strong and you should be proud. You've made it through a challenging year and are still standing. That is something to be proud of. 

As always, my inbox is always open if you want to chat or if you need some encouragement. Enjoy this break and try to relax. You've made it. 💕",2020-12-19 09:53
I am not sure if I've lost all hope yet,253,https://i.redd.it/evdo6np0ah261.jpg,2,,2020-11-30 18:25
aRE yOu tALKinG?,255,https://i.redd.it/qx74wiw7yu161.jpg,4,,2020-11-27 15:23
"As an effort to prevent the spreading of germs, me and my textbooks have decided that we would stop touching each other 2 month ago.",256,https://www.reddit.com/r/uAlberta/comments/fk6yem/as_an_effort_to_prevent_the_spreading_of_germs_me/,1,,2020-03-17 09:16
Thank you r/ualberta,256,https://www.reddit.com/r/uAlberta/comments/edis4g/thank_you_rualberta/,21,Thank you for answering my questions about school and not being rude assholes about it unlike those academic advisors. Thank you for giving me recommendations and information on each class and professor so I know whether they are good or shitty. Thank you for all the helpful PSAs that make my student life easier. Thank you for all the memes and hilarious stories. Thank you all for being active members on this subreddit that contribute to the discussion. The shy introvert in me thanks you. Enjoy the holidays!,2019-12-20 17:45
Old but gold,256,https://i.redd.it/o6neadavcz141.jpg,5,,2019-12-01 01:11
i made it today!!!,255,https://www.reddit.com/r/uAlberta/comments/e03lrx/i_made_it_today/,25,"this isn't big but i've skipped almost this entire week due to poor mental health but i made it here today! actually ten minutes early too :')

edit: hi!! i wasn't expecting all these replies but thank you so much all u sweet BEAUTIFUL people <3 your responses means a lot 🥺",2019-11-22 09:49
Y'all start using socks or something smh,256,https://i.redd.it/inuccogvcdq31.jpg,40,,2019-10-03 12:27
"FREEDOM NO MORE: Display of profound photos from Hong Kong, in SUB this weekend.",254,https://www.reddit.com/gallery/va3c27,45,,2022-06-11 12:19
To the girl wearing a beige hoodie and vest in CAB this morning...,254,https://www.reddit.com/r/uAlberta/comments/q4byze/to_the_girl_wearing_a_beige_hoodie_and_vest_in/,19,"Hi, you don't know me, but I saw you and who I think is your boyfriend in CAB basement, on the opposite side of Remedy, this morning around 10AM. You left to go to class, but your boyfriend stuck around to hang out with a friend. Or at first I thought they were friends. But they were so touchy with each other: sitting way too close to each other despite the empty chairs, him rubbing her back constantly, legs touching under the table, constantly leaning over towards each other, and at one point, almost touching foreheads because they were so close. I hope I'm wrong, and he's not your boyfriend, but if this gets back to you, I thought you deserved to know.",2021-10-08 20:00
Not exactly what I had in mind,254,https://i.redd.it/d8akgg8s8tn71.png,2,,2021-09-16 00:36
How I'm feeling 3 weeks into the semester,257,https://i.redd.it/ux79wynqcde61.jpg,7,,2021-01-29 18:03
The best way to meet people this semester,255,https://i.redd.it/2wby7cmw72m51.jpg,5,,2020-09-08 23:40
Shot of the campus in the newest Microsoft Flight Sim,255,https://i.redd.it/73l2pqxansh51.jpg,22,,2020-08-18 11:12
First year students 10 minutes before the class ends,253,https://i.redd.it/91ww1tqdx1l21.jpg,8,,2019-03-09 01:11
Grading system changes: Exploration Credits are now University policy!,250,https://www.reddit.com/r/uAlberta/comments/tsgb0t/grading_system_changes_exploration_credits_are/,43,"Hey everyone,

Some of you might remember that Abner and I ran on creating a limited, optional pass-fail grading option for students in the 2021 UASU elections. After about 13 months of working through governance, that system is now here!

I'm sure we've all noticed how many posts here ask about GPA boosters and easy electives, and I've definitely found easy electives whenever I could to protect my GPA throughout my degree. This perverse incentive to not take courses outside your comfort zone or try new things is really the opposite of what University should be about, and I know it sucks for students. The goal of exploration credits is to help you take electives you actually find interesting without having to worry about your GPA. Here's how it works:

* For up to four electives in your degree, you will be able to take them as a CR/NCR course rather than for a letter grade. An exploration credit will not affect your GPA, but will count towards your degree
* You will be able to wait until the withdrawal deadline and get a sense of how hard the course is before choosing whether to take a letter grade or a CR/NCR
* Open electives all automatically qualify for exploration credits, but faculties can also choose to make list electives (like Complementary Studies and ITS in Engineering) eligible for exploration credits. Getting as many list electives as possible eligible will be a big academic advocacy project for us next year, but the response has been very positive so far
* Instructors won't know whether a student is enrolled for a letter grade or Exploration Credits
* There are some restrictions-- for example, you can only take one per term. You'll also need to be aware of any potential program impacts, because once you choose the exploration credits option, you can't reverse it
* To help students understand this better, academic advisors will be getting training over the summer on how Exploration Credits work and any potential impacts to your degree. To make sure students know how to choose exploration credits and that it's an option, there will be a bunch more communication about this in the fall, especially as we come up on the Withdrawal Deadline. Some details (like how exactly this will look on Bear Tracks) will be finalized over the summer

While many Canadian universities have some form of limited, optional CR/NCR policy for electives, I think we are now jumping to the front of the line with one of the most progressive and accessible policies in the country. This change was passed by GFC on the 21st and is now official university policy. If you're interested in all the technical details, it's [Item 10 on this GFC agenda](https://www.ualberta.ca/governance/media-library/documents/member-zone/gfc/agenda-and-docs/2022-03-21-gfc-agenda-documents.pdf). I hope this change is useful for you all and can answer any questions you have about this policy here or by email at president@su.ualberta.ca",2022-03-30 13:44
I miss going to the library,251,https://i.redd.it/m6peyek3pbn51.jpg,2,,2020-09-15 08:37
Straight facts tho,251,https://i.redd.it/hx84ny16qgj51.jpg,25,,2020-08-26 21:15
Operation: Cowboy Hat on CCIS Dinosaur,250,https://www.reddit.com/r/uAlberta/comments/fsgdt9/operation_cowboy_hat_on_ccis_dinosaur/,26,"Okay hear me out. Whether you call it a dinosaur, a plesiosaur, or an elasmosaurus, we're all referring to the same thing so I'm calling it a mf dinosaur. Tomorrow is April Fool's and campus is dead quiet, so it's the perfect time to put a cowboy hat on the CCIS dinosaur. I propose a well thought out, meticulous plan:

1. We get in contact with the law office burglar from the beginning of the school year. It seems as if they already know how to break into campus easily.

2. Form a human tower from L2 up. Don't want anyone to fall two levels down trying to put the hat on the dinosaur. 

3. If we caught then we can use the April Fool's excuse. It's just a prank bro

4. Yeehaw",2020-03-31 10:48
What the curve is gonna look like with y'all cheating on examlock,250,https://i.redd.it/0x4bvxksojn41.jpg,11,,2020-03-18 21:01
I finally accomplished today!,254,https://www.reddit.com/r/uAlberta/comments/eslzcv/i_finally_accomplished_today/,8,"I ordered a pizza today to celebrate the fact that I did two presentations for my classes, finished all my research study credits, I'm making lots of friends this semester and I've been working out almost every day! This semester is going well for me and I got lots of important stuff from my courses done and over with.",2020-01-22 18:41
:33,255,https://i.redd.it/itd0t2ravix31.jpg,4,,2019-11-08 13:28
Stolen,254,https://i.redd.it/8kuch88xkjt31.jpg,19,,2019-10-19 12:35
Open for luck dudes,252,https://i.redd.it/iny6v4a4oh321.png,5,,2018-12-10 10:53
when you finish bombing an exam and go to hub to forget about your declining grades and decide that you deserve to treat yourself to just a lil snack bc you've worked so hard but it isn't paying off but you need sumthin to get you through the day even though you have no money but food helps the pain,253,https://v.redd.it/ld8brawrrhy91,7,,2022-11-07 01:44
Who else got that October depression looming in?,253,https://i.redd.it/phi6k2rlfrr71.jpg,8,,2021-10-05 22:46
That's a long hiatus to get that degree though,250,https://i.redd.it/y7an04wyot961.png,11,,2021-01-06 19:45
Just went outside and......,252,https://www.reddit.com/r/uAlberta/comments/jha7mt/just_went_outside_and/,20,I have become an avid supporter of online winter term.,2020-10-24 08:52
University for me,252,https://i.redd.it/26i3cwan7rb51.jpg,15,,2020-07-18 23:58
Jokes on you guys I've been self isolating since I started University,256,https://www.reddit.com/r/uAlberta/comments/fh65yk/jokes_on_you_guys_ive_been_self_isolating_since_i/,7,Yeah I don't go to class anyways.. woops,2020-03-11 16:58
"sask kids when the prof says ""you learned this in bio/chem/phys 20""",254,https://i.redd.it/g6nodq06eno31.gif,26,,2019-09-24 20:04
Anything to pass,251,https://i.redd.it/ctp91qqf42r21.png,6,,2019-04-08 09:15
Campus is beautiful at night,252,https://i.imgur.com/yqjkWSq.gifv,14,,2018-11-16 00:27
I wish everyone all the best for this semester 😊💜,249,https://i.redd.it/2kuow8qzpcl91.jpg,8,,2022-09-01 19:53
To the guy crying during the chem 105 final today,248,https://www.reddit.com/r/uAlberta/comments/ucj0gt/to_the_guy_crying_during_the_chem_105_final_today/,42,"Bro I hope you're okay...

May the curve carry us all.",2022-04-26 12:18
Fall semester vs Winter. Ive failed 4 classes in total and these are my first A/A+'s. IM SO HAPPY!!!!,249,https://i.redd.it/b7q2sr1e81y61.jpg,18,,2021-05-08 23:40
In an open book exam too...,250,https://i.redd.it/tin7mrwt0hl61.jpg,13,,2021-03-06 13:52
Lopelmann's deferred final is optional!! Praise be to the psychology overlords!!,252,https://v.redd.it/xn2e32kijf561,12,,2020-12-15 15:49
Examlock after you flag 1 question,250,https://i.redd.it/l67o74ukpsr51.jpg,6,,2020-10-07 22:07
kids going back to school in the fall,252,https://i.redd.it/ksh9pj9l9od51.png,30,,2020-07-28 16:12
A meme from 2021 :,249,https://i.redd.it/eju0aechunp41.jpg,5,,2020-03-29 13:08
Oh.,251,https://i.redd.it/eehagvfuddq21.jpg,9,,2019-04-04 22:03
When you find the scumbag who's been preventing you from studying,250,https://i.redd.it/h7gag89ldxn21.jpg,1,,2019-03-23 14:06
A message for all naive first years,252,https://www.reddit.com/r/uAlberta/comments/9cr4yd/a_message_for_all_naive_first_years/,19,"During the first week of classes, someone might give a presentation to your class about a potential summer job. It might sound good, but it's probably a pyramid scheme. They'll pass a clipboard around where you can enter your contact information. Do not sign up. It's a scam. ",2018-09-03 19:19
Just dropped down 2 letter grades from a final. Life is great!,250,https://i.redd.it/l7yy4gl6n56c1.jpg,21,,2023-12-13 17:27
"That's only four things - this really helped me put my crazy schedule in perspective this morning - I know some of you could use some too. This time of year is insanely stress-inducing, but we got this!",250,https://i.redd.it/2dluwrtjwso61.jpg,0,,2021-03-23 10:04
Danger birbs seen on campus,250,https://i.redd.it/igg7a2avz1s41.jpg,16,,2020-04-10 14:51
If your name is Patrick and you have a date for valentines,252,https://www.reddit.com/r/uAlberta/comments/evs9qw/if_your_name_is_patrick_and_you_have_a_date_for/,52,I just heard a group of girls talking and one of them said she got asked out by a guy named Patrick for Valentine's Day and that she accepted for the free meal. Be careful y'all,2020-01-29 13:03
Me on campus for the first time in 2 years,249,https://i.redd.it/hqdmaho6gfk81.png,9,,2022-02-27 12:36
And now we wait,251,https://i.redd.it/ul1rujefd9661.jpg,6,,2020-12-19 20:06
My resume after covid,247,https://i.redd.it/xlvx0u94tdx41.jpg,1,,2020-05-08 09:17
the real daily grind,249,https://i.redd.it/iv4wrh2vw4041.jpg,2,,2019-11-21 17:44
"Jokes aside... do your part, wear your mask properly",248,https://i.redd.it/qyalc6dc9xk71.jpg,12,,2021-09-01 10:53
I'm struggling hard,249,https://www.reddit.com/r/uAlberta/comments/m1l0nf/im_struggling_hard/,24,"I really do not understand why I am having such a hard time compared to last semester. I can't motivate myself at all, I'm only doing work the day before it's due, I can't get myself to do any of my discussion or forum posts. I really can barely drag myself out of bed at this point. Next week I have 3 midterms, a research essay, and a class presentation and I don't know how I'm gonna make it through the week. It feels like time is flying by so fast yet inching so slow at the same time. I feel burnt out to a level I've never experienced before.

Edit: grammar bc I feel drunk on lack of sleep",2021-03-09 17:44
Just curious can we do this please😅😂,251,https://i.redd.it/bteoy4big5k61.jpg,8,,2021-02-27 21:55
Still on that exam life,248,https://www.reddit.com/r/uAlberta/comments/kh42o6/still_on_that_exam_life/,40,Anyone still have an exam on Mon or Tues and feel like they are close to snapping? And/or sooo jealous of those who are done and get to relax and enjoy Christmas 😩,2020-12-20 15:40
"I beg for people to try and be understanding. This isn't an official message, obviously, but just my own personal experience.",248,https://www.reddit.com/r/uAlberta/comments/fj6z7q/i_beg_for_people_to_try_and_be_understanding_this/,10,"I understand that most people probably are frustrated with the current situation. Who wouldn't be? You have paid good money to attend the courses here and have an expectation of a certain level of content delivery and professionalism. Something I and all of my fellow instructors undeniably want to do.

This virus has truly changed the playing field in many very serious ways. Course material that was expected to be delivered in person, and has been successfully delivered in person for many years for some of us, is now online.

This is something many of us instructors have never done before. This is uncharted territory for many of us who are used to the more ""traditional"" styles of giving a lecture in person.

**This takes away many advantages we had that we can no longer do:**

\-We cannot gauge attention or concern by evaluating student's faces.

\-We are unable to as easily be consulted for questions. Whether this be during lecture or after the lecture or office hours. I'm still, myself, not sure what the best way to go about doing this is yet.

\-We are not used to this style of teaching period. These tools are unique. We may be using various softwares to try and incorporate feedback, video, audio and the like. We will have technical issues. Many of us are used to writing on write boards as we go through material in order to help students follow along with us.

\-There are a few others but I will not prattle further.

***My point is that yes, in many cases you will have a lowered quality of instruction. You will likely get very confused at some points. There is a high chance of frustration at this point.***

*If you want the brutal truth: Many of us are LEARNING how to do this at the same time as you are learning the material. This will have bumps and bruises, we will make mistakes and we will sometimes stumble over ourselves. This is many of our first time ever doing this.* ***We are in an odd way, students as well as instructors now. I have NEVER done this before. I don't know how this will go.***

We're doing our best. I can attest for myself when I say I've been burning all of this time trying to rush to move course content online to try and deliver the best experience for my students. We do care.

I will be frank: I am not ready for Tuesday and I am sure I am not alone in this. I have many anxieties going forward about how this may play out. But these are just my own personal thoughts and opinions.

I hope people can understand we are trying our best. Few anticipated things to pan out this way. Many others that I speak to that are instructing are also extremely stressed out, overwhelmed and extremely worried. Please believe me when I say many of us genuinely authentically are trying to make this work.

We are at a break-neck pace with this. I can speak for myself when I say I didn't know about this plan until everyone else did. That same notification everyone else got is the one I did myself.

And giving feedback is important, we are new to this and now many of us instructors are learning how to teach and deliver in this new format effectively. Prompt constructive feedback makes a world of difference.",2020-03-15 13:31
university professors sending out emails emphasizing that the closure is temporary,247,https://i.redd.it/sx7hvhswsgm41.png,6,,2020-03-13 10:15
Me looking at the green digital clocks during an exam,249,https://i.redd.it/mdqcag3b8rz31.jpg,4,,2019-11-19 19:43
sidewalk babies outside lrt,250,https://i.redd.it/pn8mup0w0jsa1.jpg,21,,2023-04-07 15:02
To the people who intervened on the LRT yesterday,247,https://www.reddit.com/r/uAlberta/comments/10k8vlw/to_the_people_who_intervened_on_the_lrt_yesterday/,27,"You folks were on the LRT leaving from century park yesterday at around 9:30 in the morning. There was a man who was being aggressive, yelling, opening and closing the windows on the train, and hitting and punching the walls and couches. He also had a backpack and a string and was whipping those at things on the train. Security was at century and told the man to calm down and asked if he was ok, and told him to ring the emergency bell if he needed anything on the train. He started really getting aggressive when the train started moving. 

He sat down next to a girl wearing a Hijab and started yelling about the devil. She was visibly scared. First another man whispered to her to take his seat, then two other girls sitting in the same area started asking if she was ok and trying to comfort her. 

All of you got off at university station and I tried to say thank you to all of you because I've been harassed on transit before but you all went off in different directions. I almost caught up with the seat guy but he was walking too fast and I couldn't keep up. 

In the small chance one of you might read this, thanks to all of you.",2023-01-24 09:05
Seriously why do we need 2 midterms in one course?,245,https://i.redd.it/fb1nfjops1w71.png,20,,2021-10-27 13:54
UofT Mandates vaccines for students and staff,246,https://i.redd.it/798iwos8wtg71.jpg,120,,2021-08-11 19:18
"Please, call me 007",244,https://i.redd.it/zxoxif9l4ub71.jpg,4,,2021-07-17 14:44
Glad to see us in the top of a list,248,https://i.imgur.com/LldLhOe.jpg,24,,2021-01-12 21:12
Fall 2020 Finals be like,248,https://i.redd.it/pxsjck9klm461.png,0,,2020-12-11 14:27
s/o to all my comrades,248,https://i.redd.it/adq6u0r8i7m51.jpg,5,,2020-09-09 17:27
oh... okay cool?,247,https://i.redd.it/gunbosih0ap41.jpg,23,,2020-03-27 14:37
Mood.,250,https://i.redd.it/lauve6pmp4x31.png,4,,2019-11-06 13:51
Hope everyone had a good first week,248,https://i.redd.it/195min5ku0l31.png,0,,2019-09-06 19:18
I can't do this anymore,246,https://i.redd.it/rsmfm7kv3a0a1.jpg,10,,2022-11-15 21:05
When that 1 kid in lecture will NOT. Stop. Asking. Questions.,245,https://v.redd.it/u1b5hf9bx7w91,15,,2022-10-26 15:29
Hogwarts Of The North™,247,https://i.redd.it/7i8q6zfm49291.png,25,,2022-05-28 11:27
Smart class dumb me,246,https://i.redd.it/wdomnbvi5d881.jpg,11,,2021-12-28 15:55
"UAlberta's Scott's Tots (""Flanagan's Shenanigans""?)",249,https://v.redd.it/aaal7dhaslk61,4,,2021-03-02 04:50
During this break consider your positions,248,https://i.redd.it/vbna27jl67i61.jpg,13,,2021-02-18 01:34
Fall 2020 in a nutshell,248,https://i.redd.it/t5q4vcku2mf51.jpg,1,,2020-08-07 10:59
Ahahaha one of my favourite posts of all time. Hope he made it in the end if it's true,245,https://i.redd.it/zs3c5smwg7l41.jpg,23,,2020-03-07 00:47
Sorry y'all,249,https://i.redd.it/i9fd2nbgsaz31.jpg,9,,2019-11-17 12:26
for anyone stressing about their gpa,245,https://i.redd.it/sdble2897acc1.jpeg,24,"my mom shared this with me; she knows i stress over my gpa incessantly despite having already gotten a summer job lined up with mnp (who did ask for my gpa, and it was much lower when i applied than after this previous term). i thought this might give some others a little bit of solace heading into a new term 🩵",2024-01-13 15:11
One more and I'm free,246,https://i.redd.it/5gy6fafjmw6c1.jpeg,11,,2023-12-17 12:12
Lemme study plz,247,https://i.redd.it/h5ilv806ywk81.jpg,15,,2022-03-01 23:19
Gift for new year: a 4.0 semester,246,https://i.redd.it/uywbthmr3x881.png,35,,2021-12-31 11:02
My heart can't take this anymore,245,https://i.redd.it/p2x9ifpfrxn71.jpg,7,,2021-09-16 15:47
