title,score,url,num_comments,body,created
It really be like this,311,https://i.redd.it/h96wtmhbuwo51.jpg,6,,2020-09-23 08:48
Idk who needs to hear this but stop trying to be funny in the zoom chat,305,https://www.reddit.com/r/uAlberta/comments/il9wlt/idk_who_needs_to_hear_this_but_stop_trying_to_be/,31,It's disruptive and you're jokes are falling flat. Please stop,2020-09-02 10:20
Waiting for that last CR on Bear Tracks like,309,https://i.redd.it/1gf08bj5rov41.png,9,,2020-04-28 22:36
"Well, well, well, if it isn't the consequences of my own actions",307,https://i.redd.it/so6iqsodedl41.png,8,,2020-03-07 23:18
Two U of A professors among dead in Tehran plane crash.,309,https://globalnews.ca/news/6381311/tehran-plane-crash-edmonton-victims/,29,,2020-01-08 08:10
0.3 seconds after class ends,309,https://i.redd.it/12ofqeryqsi21.jpg,6,,2019-02-25 16:11
Pretending not to be out of shape and dying after walking up three flights of broken escalators in the U of A station,308,https://i.redd.it/1qg4e3q23yoa1.jpg,20,,2023-03-20 08:23
Can't even afford to water our plants down there,308,https://i.redd.it/4au3nm52czda1.jpg,26,,2023-01-23 23:49
Happy 2021 graduation!,309,https://i.redd.it/5yy6py0vpf771.jpg,18,,2021-06-25 10:00
Watching the class average go up as people drop after the midterm,308,https://media.giphy.com/media/32mC2kXYWCsg0/giphy.gif,11,,2021-02-26 12:13
If I see one more first year complain about a B I'll lose it,305,https://i.redd.it/a8s004ep23i61.jpg,9,,2021-02-17 11:45
I CANT DO THIS ANYMORE,308,https://www.reddit.com/r/uAlberta/comments/k33cvi/i_cant_do_this_anymore/,41,AM I THE ONLY PERSON WHO LITERALLY IS DOING NOTHING BECAUSE THEY CANT GET THEMSELF TO DO IT BECAUSE THEY FEEL LIKE THERE NOT EVEN IN SCHOOL BECAUSE THEY SLOWLY STOPPED ATTENDING LECTURES BECAUSE THE PROFFS WERE SO BADAND BECAUSE THEY HAVNT BEEN TO CAMPUS IN SO LONG THEREFORE MAKING IT FEEL LIKE NONE OF THIS EXISTS LIKE WHAT IS HAPPENING AM I EVEN A UNIVERSITY STUDENT ANYMORE I FEEL LIKE EVERYONE IS STUDYING EVERY DAY AND I LITERALLY HAVNT SUBMITTED A COUPLE ASSIGMMENTS AND GOT 0S AND IM JUST SO TIRED LIKE I WENT FROM A STRAIGHT A STUDENT TO LITERAL BELOW CLASS AVERAGE CAN THIS SEMESTER BE OVER PLEASE I DONT WANT TO TEACH MYSELF EVERYTHING ANYMORE,2020-11-28 21:54
Uni: wrecking my sleep schedule since 2017,304,https://i.redd.it/2re4t8zstd751.jpg,3,,2020-06-26 22:42
The influx of posts about BLM from Canadian uni students is nothing more than virtue signalling CMV,308,https://www.reddit.com/r/uAlberta/comments/gv55li/the_influx_of_posts_about_blm_from_canadian_uni/,51,"Let me preface this by saying, 99% of the time the term “virtue-signalling” is used, it's used by people trying to undermine genuine ideological arguments from people on the left. This time however, i think its use is genuinely necessary. 

During my time here i've made a ton of very diverse friends. I'm also an out of province student and made a ton of friends in my hometown. All of a sudden everyone suddenly “cares” about black people, including people i've had racist interactions with, or who've just stood by and watched as I was experiencing racism.

Even if we ignore my anecdotes, what the fuck does Sally from UAlberta posting about BLM do for anybody? Literally nothing. 0. Not one racist will sit there and read a few tweets and suddenly think “huh... Sally might be onto something”. Instead they'll think “let me post something just like Sally. SEE. Im not racist!!!! I just dont like blacks!!!”.  My feed and my timeline are bombarded by a bunch of virtue-signalling fucks who dont positively contribute to anything, so they decide to post a few BLM links and now they feel like they've come and saved the day. Racism cured. I understand commenting on celebrity/influencer posts to pressure them into speaking out, bc they actually have a PLATFORM and for some reason people genuinely CARE about what they think. But Sally, no one gives a fuck what you post. Frankly, being black in Canada cant even be compared to being black in the states. The real problem we have here is the INSANE systemic racism against the indigenous. Why don't we focus on our society before virtue signalling and getting up in arms about whats happening across the border? 

Let me be clear. The protesting in the US is necessary, and the rioting is achieving worldwide attention which is exactly its purpose. But my points above still stand. 

TLDR; Fuck all the Sally's and Singh's pretending to care about us and posting about BLM to feel better about themselves.

Edit: My view has changed slightly as a result of some of the comments in this thread. Reposting the RIGHT type of posts could potentially have a small impact if your social media accounts are followed by people who may be racist and MIGHT actually look inwards. That being said, it is possible that this sudden influx of posts could have a net-negative impact on the issue since people are starting to feel like posting a few black squares is enough and now they've done their part when in reality there's still so much work to do. Thanks for all the discussion today everyone.",2020-06-02 04:52
*cries while turning off camera*,307,https://i.redd.it/s9ow72rplbp41.jpg,5,,2020-03-27 19:57
😂,309,https://i.redd.it/r8y2pq3su0t31.jpg,8,,2019-10-16 21:36
International students can anonymously report classes that don't have recorded lecture or have participation marks,307,https://i.redd.it/3om9290rhjc61.jpg,16,,2021-01-20 12:33
Abdgajsbwj HOLY SHIT I'm gonna be riding this high for the rest of my life,307,https://i.redd.it/hulyqd5esi561.jpg,20,,2020-12-16 02:42
happy halloween folks! hopefully midterms this year won't be spooky for you,307,https://i.imgur.com/5Ji4Oxr.jpg,2,,2020-10-31 02:09
rip to reading week 😔,307,https://i.redd.it/dnisnp8xr3z31.jpg,24,,2019-11-16 12:50
"Found another one. This time, per someone's request, it went to the recycle bin.",307,https://i.redd.it/ebhtke9g31m31.jpg,15,,2019-09-11 14:56
I'm going to miss that resounding applause students give the prof at the end of the last class of the term,308,https://www.reddit.com/r/uAlberta/comments/k4p2ra/im_going_to_miss_that_resounding_applause/,27,"Idk man, maybe I'm just a softie but that would always hit me in the feels... especially if it was a good class with a good prof :( I'm in mostly asynchronous classes this semester so if it's a thing over zoom I won't know, but even then I don't think it would hit the same as it did in a big lecture hall with a bunch of students",2020-12-01 10:08
nothing beats spending weekends doing coursework,304,https://i.redd.it/v7omvtak1wq51.jpg,19,,2020-10-03 08:15
Me writing all my finals this semester,309,https://i.redd.it/f3wi2cdlu7u41.jpg,6,,2020-04-21 12:41
Edmonton winters tho,302,https://i.redd.it/dq3px2lz97h41.jpg,16,,2020-02-15 19:51
Oops,305,https://i.redd.it/1fbmwndsr7741.png,3,,2019-12-27 10:50
I made a chrome extension that shower you with confetti when you submit assignments/quizzes.,304,https://v.redd.it/icwdqpaye8t91,13,,2022-10-11 13:55
I've seen some people on here struggling with money to get food so i just wanted to post this.,303,https://www.reddit.com/r/uAlberta/comments/uqjyzy/ive_seen_some_people_on_here_struggling_with/,36,"I've seen a few people on here talk about their struggles with having enough money for food and I wanted to make a post that might help.

I know a lot of kids are struggling with rising tuition and it can be hard to find money for food, so, I just wanted to let you know of some places to get free food.

I myself am sikh, and its part of the sikh religion to serve the community and sikh temples offer free food to anyone who walks in. if you can bus to a sikh temple in Edmonton, the temple offers free food to anyone in the basement. freshly cooked and hot. its ok if you're not sikh, they welcome anyone of any race or religion. you just have to cover your head with a scarf in respect for the temple, otherwise they will give you a free hot meal with no questions asked <3

the meals typically consist of roti (a type of indian flat bread), plain yogurt, some type of dessert (such as sweet rice), and a curry or vegetable dish.

i hope this helps <3

Edit: if you have any questions, feel free to reach out and ask

i also should have mentioned this but i completely forgot. I'm not sure if all gurdwaras serve food everyday but i know this one does for sure.

[https://www.google.com/search?gs\_ssp=eJzj4tZP1zcsSTEvLk8pMWC0UjWoMDVONDC0NDRKTElMMk4zNrQyqDBONbM0Tk5Ltkw2TLYwNDbwEipKzE1PLMrITFRILy1KKU8sSgQA\_KEWKQ&q=ramgarhia+gurdwara&oq=ramgariah+&aqs=chrome.2.69i57j46i10i175i199l2j0i10l2j46i10i175i199j0i10j46i10i175i199l2.4659j0j7&sourceid=chrome&ie=UTF-8](https://www.google.com/search?gs_ssp=eJzj4tZP1zcsSTEvLk8pMWC0UjWoMDVONDC0NDRKTElMMk4zNrQyqDBONbM0Tk5Ltkw2TLYwNDbwEipKzE1PLMrITFRILy1KKU8sSgQA_KEWKQ&q=ramgarhia+gurdwara&oq=ramgariah+&aqs=chrome.2.69i57j46i10i175i199l2j0i10l2j46i10i175i199j0i10j46i10i175i199l2.4659j0j7&sourceid=chrome&ie=UTF-8)

\^ people have posted pictures of the food, kitchen, and of people coming down there to eat if you're a bit skeptical (totally understandable)",2022-05-15 18:58
took a stroll through an empty campus. it was eerie.,304,https://www.reddit.com/gallery/m7iwfo,17,,2021-03-17 22:18
Move out emails are getting increasingly aggressive...,304,https://i.redd.it/t7uex1czcrva1.png,27,"Apparently the daily ""Move out emails"" weren't quite getting the point across...",2023-04-23 17:15
The last 5 minutes of the exams are the most important.,304,https://i.redd.it/hx1o1hkpftr51.jpg,5,,2020-10-08 00:33
The 10 minute walk challenge - ACCEPTED.,304,https://www.reddit.com/r/uAlberta/comments/a7danc/the_10_minute_walk_challenge_accepted/,35,"I decided to try the challenge, and for my first time, I do ECHA to Tory Turtle in under 10 minutes. Note that the video is played back at 4x the speed.

[Here's the video documenting it.](https://youtu.be/H3v3ngBTdgE) Apologies for the shakiness; I can't do anything about it!

If you like it, comment below the video for other start and end destinations I should do!

Edit: Thank you so much for over 1000 views!",2018-12-18 10:44
I just dropped a class and bought myself a PS5.,298,https://www.reddit.com/r/uAlberta/comments/1274303/i_just_dropped_a_class_and_bought_myself_a_ps5/,54,"Remember nothing is worth it over your mental health and well-being. If a class is making your life miserable, take the W ;) Better to take an extra semester happily than been depressed for an entire one.",2023-03-30 18:13
To the nice girl on Whyte Ave that offered to let me hop in her uber with her,306,https://www.reddit.com/r/uAlberta/comments/xsfw5w/to_the_nice_girl_on_whyte_ave_that_offered_to_let/,6,"We were waiting at a bus stop on Whyte Ave around noon when 2 full busses drove past our stop. A girl approached me and one other guy and asked if we were going to the university as well, and she said she called an uber and offered to let us ride with her. I said sure, what's your email? I'll send you some money and we'll split it, and she said nope its fine, I've got it. 

Wherever you are, you made my whole day and I'm really glad that there are still some unselfish people left in the world.",2022-09-30 17:27
good to see they're full of life,303,https://i.redd.it/of3hcbpeb3k91.jpg,17,,2022-08-26 11:09
It's been 25 days since I submitted my paper this is a crime,303,https://i.redd.it/yapd58ppj6y61.jpg,9,,2021-05-09 17:32
"so, how about that last week stress?",300,https://i.redd.it/w74xhogloes61.jpg,8,,2021-04-10 14:29
Me: IT LITERALLY WASN'T IN THE RUBRIC THOUGH | TA: I posted it on the forum | The forum:,304,https://i.redd.it/p37tuu9mwwz51.png,21,,2020-11-17 19:46
U of A profs increasing student workload in the midst of a global pandemic like,302,https://i.redd.it/qvhjzkjuh4p41.png,17,,2020-03-26 20:03
When you have an exam the next day.,303,https://i.redd.it/dtz536nmyps31.jpg,5,,2019-10-15 08:59
people doing the deed in echa,305,https://www.reddit.com/r/uAlberta/comments/y7umar/people_doing_the_deed_in_echa/,35,"yall need to be stopped bro i'm trying to find a seminar room in echa today it was like 8:45 pm I walk in the room and I see yall hoes getting it down. like. I screamed and I started crying. r u guys like not embarrassed I hope u guys read this shit because I did not go into echa thinking I was gonna see some random peoples musty dusty crusty genitals. and even worse the girl was smiling at me?? like hehe oops! pls for the love of god go home and do ur nasty shit its fucking disgusting.  a taken post-it on the window isn't gonna stop people from walking in. and you had the light off too?????? safe to say I will never be stepping foot in that seminar room again. and to whomever, it may concern it was not big.",2022-10-19 00:07
“PeNgUiN liVe In AnTaRtiCa”,300,https://www.reddit.com/r/uAlberta/comments/jntg2c/penguin_live_in_antartica/,13,over it,2020-11-04 01:58
y'all ready?,302,https://i.redd.it/f6d6krz70r341.jpg,7,,2019-12-09 23:14
Favourite button during asynchronous classes right now,301,https://i.redd.it/6vgzrba28fm51.png,14,,2020-09-10 19:25
Some of you have to know the difference between expressing valid criticism and being downright rude,298,https://i.redd.it/ix2v2x6hlzl51.jpg,70,,2020-09-08 14:51
my brain is turning to mush,299,https://i.redd.it/x4t66xzlx3561.jpg,4,,2020-12-14 00:45
Pretty much every university student,301,https://i.imgur.com/zBvLjGW.jpg,6,,2020-09-08 09:57
The desks keep physiotherapists in business,297,https://i.redd.it/qdinf85xxk251.jpg,20,,2020-06-02 17:16
Smh,299,https://i.redd.it/r5gkrm3yr1w41.jpg,7,,2020-04-30 18:24
Good luck everyone! RIP GPA,301,https://i.redd.it/3zrq8a6umm341.jpg,20,,2019-12-09 08:32
"UofC. If you upvote this, it will show up on google images when people search uofC, or University of Calgary.",301,https://i.redd.it/m4kswjttcl4y.jpg,7,,2016-12-19 14:26
Puss in Boots goes on reading week,300,https://v.redd.it/ji3yf3tpyvia1,6,,2023-02-17 17:51
"Respectfully, keep it to yourself",297,https://v.redd.it/al03edghu5781,42,,2021-12-22 14:18
Stop Shitting on First Years,302,https://www.reddit.com/r/uAlberta/comments/ni4sky/stop_shitting_on_first_years/,42,"They've already lost a grad, had a rushed grade 12 (4 semesters instead of 2 for EPSB), and spent their final year distancing and wearing masks instead of socializing freely and going out like we got to during our last year of high school. If they're stressed about making their first year schedule, it's only justified after such a hectic end to their high school experience. Some of the kids I tutor have started crying right in front of me from their stress. Stop with these boomer ass comments and have some empathy.",2021-05-21 16:37
"Lookin at you, profs 👀",298,https://i.redd.it/rg0zdr2x9hi61.jpg,4,,2021-02-19 11:33
"When your prof says I know class is over, but...",299,https://i.redd.it/ep1usiipz3v51.jpg,1,,2020-10-24 15:15
"We are at home, that MUST mean we are free all day and have nothing to do!",301,https://i.redd.it/xc01ia01bks51.jpg,5,,2020-10-11 18:55
7%,299,https://i.redd.it/hlakngti5db51.jpg,10,,2020-07-17 00:41
Took about 50 of these down today in Basement & 1st floor Tory!,300,https://i.imgur.com/UBD3hq1.jpg,45,,2020-02-03 15:15
Managed to land an airplane over HUB,298,https://v.redd.it/ypc1mxun82e71,14,,2021-07-28 20:10
Shots fired,299,https://i.redd.it/6yc1xey7fny41.jpg,14,,2020-05-13 21:20
Sleep well my cuties,300,https://i.redd.it/j54dz27oefi41.jpg,6,,2020-02-22 00:16
"UPDATE: I distributed 5 microwaves around campus, the rest were taken by people. One is in the Rutherford lounge in HUB. One in Ed. One in Business and then two in humanities (pic). More detailed in comments!",295,https://i.redd.it/or8a4l4btig31.jpg,19,,2019-08-14 20:06
You got your last grade back. It's cloudy outside but you are in your warm blanket with warm food and drink. Life's good.,295,https://i.redd.it/eudtqpexusx61.png,12,,2021-05-07 19:31
Idk if I want to take an exam here again...,300,https://i.redd.it/jh9dsbyfrzc61.jpg,11,,2021-01-22 19:16
Good luck on your finals everyone! :),298,https://i.redd.it/ayn1ix2xms361.jpg,5,,2020-12-07 09:41
Don't fall into this trap,296,https://www.reddit.com/r/uAlberta/comments/19c84dy/dont_fall_into_this_trap/,14,"Work on your shit the day you get it. Maybe you don't have to finish it, but things pile on very fast and I can't stress that enough. These first 3 weeks you probably won't have anything to do and you will relax, suddenly, next week is midterm season. Then a week or two after midterm season is finals and then your semester is over. So if you think you have nothing to do, you are probably behind.",2024-01-21 10:09
eclass is burnt out,298,https://i.redd.it/1n6wqaxgms681.png,4,,2021-12-20 17:52
First A... ever!,296,https://www.reddit.com/r/uAlberta/comments/n5zc71/first_a_ever/,26,"So I just got my some of my grades back from the winter semester and I saw i had gotten my first A... ever! I know this is literally not a big deal to a lot of people out there, but as someone who has struggled with academics due to mental health issues and learning disabilities this feels like such a win! Getting this A after spending a year contemplating whether or not i should drop out feels extremely reassuring. So i felt like sharing. lol",2021-05-05 22:42
Is it me or do icons feel more outdated :/,296,https://i.redd.it/bx0p91zjddk61.jpg,10,,2021-03-01 00:32
pls tell me im not the only one who hasn't been able to get like any work done these past couple of days,294,https://www.reddit.com/r/uAlberta/comments/fjclmt/pls_tell_me_im_not_the_only_one_who_hasnt_been/,28,"i have 2 midterms next week and im not prepared

cant

focus 

:/",2020-03-15 19:25
This is why tuition went up,297,https://v.redd.it/bf5edjz92dlb1,19,,2023-08-30 20:57
I GOT 4 SCHOLARSHIPS TOTALLING TO 17.5k CAD!,295,https://www.reddit.com/r/uAlberta/comments/l4bvpa/i_got_4_scholarships_totalling_to_175k_cad/,57,"I'm an international applicant, just got the email stating that I got 4 entrance scholarships! Waiting for the application based scholarship rn 🤞",2021-01-24 17:41
and so it begins,292,https://i.redd.it/9jmrsyuqxzs41.jpg,12,,2020-04-15 09:00
Prof's with a sense humour,295,https://i.redd.it/o00rc7ax70c41.jpg,29,,2020-01-20 14:48
How it really is every week.,296,https://i.redd.it/w5uu60eaqxz31.jpg,8,,2019-11-20 17:35
"Those who are about to fail, i salute you",294,https://www.reddit.com/r/uAlberta/comments/12npoh1/those_who_are_about_to_fail_i_salute_you/,24,This data has been replaced & removed. Send your thanks to reddit CEO huffman /u/spez. -- mass edited with https://redact.dev/,2023-04-15 19:11
U of A Student Spotted on LRT this Coming Monday Morning,294,https://i.redd.it/4db1ytf0d3k81.png,5,,2022-02-25 19:50
Two year anniversary coming up :/,294,https://i.redd.it/xns798pb2kb81.jpg,7,,2022-01-13 18:26
We made a Chrome Extension that shows RateMyProf ratings in Beartracks,294,https://www.reddit.com/r/uAlberta/comments/op6a5e/we_made_a_chrome_extension_that_shows_ratemyprof/,17,"Hi guys,

We made a google chrome extension called RateMyTracks that shows the RateMyProfs ratings of each professor next to their name in a class search. It adds another column next to the prof's name and shows their rating out of 5. This extension is also completely free and can be easily disabled. You can add the extension at the [chrome webstore link](https://chrome.google.com/webstore/detail/ratemytracks/fejbmlpffkoiinhibcojnjldfhedomfe). 

For some professors, the name in RateMyProfs does not match their name in Beartracks. If you see a prof that has no rating but does exist in RateMyProfs or you notice anything wonky, you can let us know by filling out this short [google form](https://forms.gle/BruiD6FEbYbbg7fA6) or by clicking the ""Contact Us"" button in the extension popup. 

Please try it out and let us know what you think of it and if we should change something.

Thanks!",2021-07-21 22:04
LRT to HUB stairs,296,https://i.redd.it/xkxym2xu97j21.jpg,5,,2019-02-27 17:01
Rich kids lolol,289,https://i.redd.it/b8eiiza6gm1a1.jpg,64,,2022-11-22 20:41
10$ to see your own enrollment is crazy,293,https://i.redd.it/bg732j44i9o81.jpg,15,,2022-03-18 21:45
"Profs: ""No devices can be used during the exam"" Also Profs: *Sends email mid-exam to tell us we have more time*",293,https://www.reddit.com/r/uAlberta/comments/kbzapq/profs_no_devices_can_be_used_during_the_exam_also/,15,??????,2020-12-12 16:17
@ the new college configuration formation,296,https://i.redd.it/x1iiei41j1461.jpg,9,,2020-12-08 15:35
God do be blessing me,293,https://i.redd.it/q9bkv3d2ad161.jpg,7,,2020-11-25 03:56
Actual thoughts of people cheating in cmput courses,290,https://i.redd.it/p4u1gtnq3gp41.png,19,,2020-03-28 11:06
IMPORTANT DATES FOR WINTER TERM WORTH REMEMBERING,290,https://www.reddit.com/r/uAlberta/comments/ek8n29/important_dates_for_winter_term_worth_remembering/,8,"**January 6:** First day of classes 

**January 17:** Winter Term Registration Deadline (Last day to add or drop Winter Term courses, Bear Tracks web registration system available until midnight)

**January 29:** Study abroad application deadline for certain University of Alberta International administered Exchanges and numerous Summer Internships 

**January 31:**  Last day for payment of Winter Term fees

**February 1:** Last day for undergraduate students to apply through Bear Tracks for permission to graduate at Spring Convocation. Also last day for application for reappraisal of final examinations for Fall Term courses.

**February 5:** Winter Term Refund Deadline (Students withdrawing from courses after this date will be assessed full fees)

**February 14:** Registration system opens for Spring/Summer 2020

**February 17:** Family Day, University Buildings Closed

**February 18-21:** Winter Reading Week 

**March 2:** Students' Union Election Forum in the Myer Horowitz Theatre (SUB). Classes withdrawn for 12:00 to 1:00 pm 

**April 1:** Last day for withdrawal from Winter Term courses

**April 8:** Last day of Winter Term classes

**April 10:** Good Friday, University buildings closed

**April 13:** Easter Monday, University buildings closed

**April 14-25:** Winter Term examinations",2020-01-04 22:23
When the guy who studies next to you suddenly bursts into laughter then starts packing with actual tears,293,https://i.redd.it/t1xmygxojv341.jpg,12,,2019-12-10 14:31
upvote if you definitely failed any of your final exams,294,https://www.reddit.com/r/uAlberta/comments/18jk2s1/upvote_if_you_definitely_failed_any_of_your_final/,10,i cant be the only one,2023-12-15 22:22
monkey do physic. monkey get reward. monkey learn.,293,https://v.redd.it/q66pks1x46r71,12,,2021-10-02 23:11
Just post my the grades already.,293,https://i.redd.it/oqta1g34ym961.jpg,9,,2021-01-05 20:58
"Like it's reading week. Hop off me, apple",295,https://i.redd.it/omy8ykwxxph41.jpg,8,,2020-02-18 10:38
"""once you're in university you won't be able to cram for exams anymore"", pfff if only my HS teacher could see me now",289,https://v.redd.it/56rup2fmgyha1,2,,2023-02-13 01:10
Autumn vibes on quad🍂,288,https://www.reddit.com/gallery/xsii15,13,,2022-09-30 19:30
i think we can handle it,291,https://i.redd.it/ff5pn38vv3661.jpg,0,,2020-12-19 01:39
Tried to find the most relatable pic of Gus,291,https://i.redd.it/2ttczdbpei361.jpg,13,,2020-12-05 23:17
When you're the only one who turned on your camera in a zoom class,291,https://i.redd.it/a2tdvkdynln51.jpg,8,,2020-09-16 18:08
When you are trying to do your weekly assignments but don't understand anything in any class so you keep switching between assignments.,290,https://i.redd.it/mzgt6u35su041.png,3,,2019-11-25 08:44
mood,292,https://i.redd.it/e506wpim6qz31.jpg,13,,2019-11-19 16:12
Truth,287,https://i.redd.it/k82htv1gofo31.jpg,32,,2019-09-23 18:07
It's been MONTHS,290,https://i.redd.it/excd31ar3tm31.jpg,3,,2019-09-15 13:08
Unpopular opinion: Undergrads should be more respectful on research floors,289,https://www.reddit.com/r/uAlberta/comments/te3ovq/unpopular_opinion_undergrads_should_be_more/,23," I get that study places are hard to come by, yes, and that it's difficult to find a quiet place to study. I, too, feel like the University has been inadequate in their return to campus plans and the constant UWS issues the past few weeks also indicate that they were not prepared for welcoming this many people to campus all at once…. 

But if you are going to look for study space on research floors and outside research labs and offices (I.e. upper floors of CCIS, Chem, DICE, etc.) please be respectful of the people who work there. Please don't move tables in front of lab doors just to sit with your friends. Please don't run laptop charging cables across the hallway when we're hauling gas tanks and carts back and forth. Please don't sit on the floor and block off the only exit simply because “that's where the only outlet is”. And for the love of god, don't get attitude when we please ask you to move so we can continue our research. 

And please try and keep your masks on, if possible. I might be alone in this, but it seems awfully privileged and entitled to come in to someone else's workplace, where they have been working and functioning without interruption for most of the pandemic, and brag about how “you're not gonna get caught up here”. To go in, interrupt grad students who are working independently and minding their own business, doing their own work, and doing their own research… for what? Why? It's so unnecessary. You're coming into someone else's space, acting like entitled children, and interrupting those of us who actually need to be here and want to work. 

I'm all for quietly and respectfully sitting at tables. But for the love of god please have a little respect.",2022-03-14 12:05
