title,score,url,num_comments,body,created
Professor Kent Rondeau has passed away,383,https://www.reddit.com/r/uAlberta/comments/18jxvaw/professor_kent_rondeau_has_passed_away/,9,"I was in his class this semester for SEM 321. Received an email from the undergraduate office about his passing. 

This is shocking, as he literally taught us last Thursday. He even emailed us not long ago about our final exam format.

I regret skipping four of his lectures, he was really passionate about his teaching. He was a good prof. Good teaching style, good notes, straight forward exams, and a generous marker.

Dr. Rondeau was very kind to his students. He was filled with passion and energy in every lecture.

I looked on his LinkedIn and he taught at the U of A for 26 years.

I will be placing flowers at his office door next week.",2023-12-16 11:53
Just kidding... I never have my camera on 😳😅,383,https://i.redd.it/d7t5b6zbr5l61.jpg,5,,2021-03-04 23:59
can i get an f in the chat?,377,https://i.redd.it/0m37olk1ygh51.jpg,2,,2020-08-16 19:51
So sad but so true.,384,https://i.redd.it/7eh1u9i2bj851.jpg,2,,2020-07-02 18:11
Fuck you to the racist pricks in PHIL today,384,https://www.reddit.com/r/uAlberta/comments/euyg91/fuck_you_to_the_racist_pricks_in_phil_today/,92,"Y'all walked in and sat in my row. One of you said “damn what if we catch the virus?” while gesturing to me before giggling with your stupid ass friend. What the fuck dude?

Edit: even if it was just a joke, it's still racist so y'all can stop defending them in the comments",2020-01-27 18:42
Need help finding my brother,383,https://i.redd.it/9lohmxtswr831.jpg,11,,2019-07-06 18:09
"Wanting to relax because it's reading week, but also needing to get assignments done",379,https://i.redd.it/dcun8dv9ymy51.jpg,4,,2020-11-11 09:13
Instant comrades,384,https://i.redd.it/mmkxm0szixg41.jpg,7,,2020-02-14 11:04
A Brief History of the Ghoul War,382,https://www.reddit.com/r/uAlberta/comments/alncmy/a_brief_history_of_the_ghoul_war/,20,"*I write this in lecture hall E1001 in ETLC. I have been here for days now, attempting to document the Ghoul War (2019) from its inception to the brutal conflict it has become, but I fear my time is running out, and my meticulous documentation is to end with it. Food is scarce, but I dare not venture out to seek it. My comrades have fallen or fled, and I am now but one man, left alone to face the evil that wanders these halls, an evil that grows bolder with each passing minute. It is only time that keeps them at bay, not a defence so much as the last dignity providence bestows upon me, a flimsy last rite to prepare me for a terrible fate. I beg of you, let my sacrifice be not in vain. Heed my words, for they will be all that remain of my foolish quest, a quest that has brought me to the end of my documentation, the end of my ambitions, and now the end of my life.*

On January 24, a post by u/lividnaynay (henceforth called “Livid”) caused something of an uproar on r/ualberta. The post, simply titled “[Take a Damn Shower](https://www.reddit.com/r/uAlberta/comments/ajdz4l/take_a_damn_shower/)” described rather vividly Livid's unpleasant olfactory encounter with another student. Livid's account is curiously accurate, despite limited understanding of the threat at the time. He described a 10-foot kill radius (experimentally confirmed) and nausea after 15 minutes raw exposure (the literature puts this value around 13.6 minutes). But at the end of the post, he wrote a simple, harmless little question, a question that would change campus as we know it:

“Can u guess my faculty?”

Within three minutes, u/sagotaromilktea responded “engineering lmaoo”.

The floodgates were open. Once people began to realize they weren't the only ones repulsed by the odors engineering students gave off, the long dormant seeds of their discontent suddenly sprouted. They were not alone in their disgust, and they revelled in the fleeting solidarity that the post evoked as it made the rounds on r/ualberta. But discontent isn't enough to start a war, especially one so monumental as this. And as all posts do, it eventually slipped away from the top, leaving only the lingering aftertaste of the rage it took with it. I think now it would be better if it stayed that way, if the war amounted only to an awareness of our feelings. If it remained contained within our minds, instead of splattered unceremoniously on the snow of quad, the stairs of ETLC, and the hearts and hands of all those who have have died at the hands of the enemy, and all those who will. It would be better for me, yes. But I digress.

The word “ghoul” didn't enter the vernacular until three days later, when u/RogerMooreIsMyDad, son of Roger Moore, made a post on r/ualberta called “[Why do the ghouls smell so bad?](https://www.reddit.com/r/uAlberta/comments/akjsg8/why_do_the_ghouls_smell_so_bad/)” The body of the post read: “I swear im going to buy a costco pack of deodorant and hand it out to all the little engg ghouls running around DICE”.

Throughout history, combatants will give their enemies derogatory names. Dehumanization is an important tool in war, as perceiving one's enemy as lacking human qualities erases much of the sympathy one would otherwise have for them. The less human something is, the easier it is to kill.

The people were stirring. They finally had a word to express their hatred, a rallying cry, and most importantly, an understanding that their feelings didn't have to be confined to a single post. The stage was finally set for war.

u/SweatyEnggGhoul (suspicious username notwithstanding) came forward several hours later with [an account](https://www.reddit.com/r/uAlberta/comments/akoetv/a_moment_of_silence_for_the_girls_in_engg/) condemning the ghouls for being not only biohazards, but also fedora-tippers. He described how he acted quickly, scaring the ghouls off with Febreze upon their attempt to cannibalise a hapless virgin. This first conflict, considered by many of my dead colleagues, and as a tribute to their memory, by me as well to be the first battle of the Ghoul War caused an uproar on the subreddit, garnering over one hundred upboats in less than a day. While the war had yet to take shape into the terrible conflict it is today, it had finally begun.

Three hours later, u/pengus-and-icecubes called the subreddit to war with perhaps one of the most beautiful speeches in military history. I have included it here, as it seems an injustice not to:

“Things are getting out of hand, we need to combat the ghouls. Bring febreze and deodorant wherever you go and don't hesitate to shoot! My nose can't handle this anymore. Teach these scum about hygiene, they're more unsafe than walking through HUB at 9pm.”

Initially, the war effort was disorganized. u/Gflsfcm8516 made a post several hours after Pengu's magnificent call to arms called “When will the war on the ghouls begin?”. But in less than a day, a ragtag assembly of troops seemed to coalesce into a strong fighting force, a feat likely owed to their commitment to the cause. Livid suffered a great loss at the hands of the new military upon his insistence not to resort to violence, and has since assumed a figurehead role, closely monitored at all times. [Propaganda art](https://i.redd.it/ylfhjzql58d21.jpg) from u/SUBRE extolling the strength and resolve of great leader Pengu was released to general acclaim.

The ghouls remained blissfully unaware of the chaos outside their faction until Jan 28, when u/Captain_Donadeo, captain of a ghoul exploratory mission, discovered SUB, a major base for the war effort. His final post revealed that he was under attack, presumably by our forces in SUB. It can only be assumed that Captain Donadeo was able to transmit a message to his superiors in ETLC, as approximately two hours later, u/Ghoul_0xFFFFFFFF, a ghoul ambassador, made a post called “ALERT FELLOW STUDENTS: The war on “Ghouls” violates university policy!”. In it, he claimed that the war violated university policy, as DICE (one of the ghoul bases) is an “odor-free zone”; as such, the administration of Febreze is disallowed. However, he went on to say that ghouls were all for war, “cuz I know we'll win with our superior \[sic\] intellect”. He brazenly threatened a Tory invasion, and concluded his statement with a reiteration of his disgustingly smug reminder of University policy.

Despite the ghoul's obviously evil intent, the army found itself unable to reconcile a DICE invasion with the laws of the institution they fought within, until u/welliguessthatslife recommended that a siege be undertaken. Febreze would be sprayed on the doors until the ghouls exhausted their supplies and were forced to surrender.

ETLC, the ghoul nest, remained a warzone. Ghouls and the alliance alike suffered heavy losses. Febreze cans, fedoras, and half-eaten corpses littered the hallways. Soldiers who were lucky to make it out alive with most of their limbs would speak of the horrors they saw, as they charged up the stairs of ETLC only to see the ghouls waiting for them at the top of the stairs, grinning through bloodied teeth, their sweat waterfalling down towards the brave soldiers who ran headlong into the cold arms of death.

And yet the battle spread. CCIS, a neutral zone, became the home of the bloodiest battles the war had scene. Ghouls furiously blasting sweat-soaked tissues at hapless neutrals while alliance soldiers struggled to balance war, sanity, and hygiene with steadily approaching midterms.

u/isthatmoi, a self-proclaimed neutral, took to the subreddit, begging for peace. His calls were condemned as traitorous, and the war raged on.

u/Known_Grape asked what a “goddammit ghoul” is. I guess that's UNKNOWN, STUPID GRAPE.

The science kids rallied in support of the alliance, with u/TheNoChillG inventing a genius explosive ghoul repellent, an invention which ended up landing him the role of Chief Technology Officer in the Ghoul War.

*There is a pounding at the door. The ghouls, how they moan with their vile, unclean lust for blood. How they sully our campus with their stench. My time is short. I must hurry.*

TheNoChillG was to be instrumental in the progress of the war. He invented a long-range ghoul repellent using his knowledge of biology and psychology, immediately employed in the DICE siege. But the losses were piling up, and leadership grew less and less dedicated. Pengu refused to take a formal leadership role in the battle, opting instead to spread more anti-ghoul propaganda and speak of plans that would ultimately lead to victory, a la Dutch.

With hope at an all-time low, the alliance tried an all-or-nothing attack. A joint siege of ETLC and DICE, attacking ETLC from the air and taking DICE with ground troops. Despite heavy casualties and waning morale, the battle was a major success for its [liberation of DICE](https://www.reddit.com/r/uAlberta/comments/alenob/nonghoul_engineers_celebrating_the_liberation_of/).

The ghouls attempted to strike back, capturing a major leader (whose name they forgot to mention so idk if this is even relevant). Rumours came down the wire of an attack on biosci. For a few hours, it seemed as if the war was over.

Then, out of nowhere, CAB, arguably the most strategic base on all of campus [was taken](https://www.reddit.com/r/uAlberta/comments/aliq7x/the_ghoul_army_has_moved_and_infiltrated_cab_in_a/?ref=readnext), along with Tory and humanities. Fighting broke out in the upper levels of CAB as [unsuspecting students were preyed upon](https://www.reddit.com/r/uAlberta/comments/aljoch/had_a_scary_encounter_in_cab_today_luckily_i/) by ghoul grunts. Ghouls began employing clever disguises, often of [business student](https://www.reddit.com/r/uAlberta/comments/alle0l/ghoul_spy_disguised_as_business_student_circa/)s. Calls were made for the Avatar to end the war. The math majors, in a semi-surprising move, joined the ghouls. The premeds supposedly joined the alliance, but none of them actually did because they were too busy with extracurriculars.

And the comp scis moved silently in the night like lasagna, waiting for their moment to strike. Against who remains unclear.

*In any case, the war rages on with no end in sight. I have seen so many innocents fall in battle, the cause marking them for slaughter on the battlefield, and yet their eyes retaining the fury of their fellows even in death. I feel sorrow at their loss, more so now that I face my own death. My sympathy for them has finally overwhelmed my devotion to that which I fight for, but it is not a sympathy I feel for myself. I feel only shame. Shame that my hatred has guided me to the doors of death, not the compassion, the joy, the love I felt in my youth. I shall die enraged, and I shall die ashamed of it.*

&#x200B;

*I urge you now, my friends, to reconcile your endeavour with the suffering that will come from it. I urge you, my friends, to live.*

&#x200B;

*The doors are opening. My final judgement at the hand of the enemy now begins.*

*Goodbye my friends. I die so that you may live. And remember:*

&#x200B;

*He who smelleth it, dealeth it*

\- Ezekiel 69:69",2019-01-31 01:08
UofA Pedway map,381,https://i.redd.it/lbvwgheb4pcc1.jpeg,29,I just remembered I had this pedway map saved on my phone - thought it might be helpful for some people looking to avoid the outdoors!,2024-01-15 17:22
What the past week was like,377,https://i.redd.it/buvz8tyv5c661.jpg,1,,2020-12-20 05:30
However.,375,https://i.redd.it/m4np7vym3iv41.jpg,2,,2020-04-28 00:13
"I don't care what the university does at this point. Pass/fail, NC/CR, graded idc. Just for the love of god, please end the semester. I'm tired and scared, it feels like the worlds gone mad and I just want to go home and pet my dog.",381,https://i.redd.it/e4owcbuj9tn41.jpg,18,,2020-03-20 05:13
I'M FINALLY DONE 😭,377,https://www.reddit.com/r/uAlberta/comments/kgq32m/im_finally_done/,23,"Just hit submit on my very last final exam, and with that, I'm finally finished my undergrad. Took 5.5 years of suffering, but it's over 😭",2020-12-20 00:42
'Tis the season,381,https://i.redd.it/d5qnls3fl0361.jpg,7,,2020-12-03 11:23
I think I'm winning,381,https://i.redd.it/1shegp1987561.jpg,91,,2020-12-14 11:50
I miss campus in the fall,373,https://i.redd.it/tjokykfdi8m51.jpg,7,,2020-09-09 20:50
Intelligence 100,372,https://i.redd.it/4f4qvbsp8gl61.jpg,11,,2021-03-06 11:15
Cat with a degree,374,https://i.redd.it/4gfy7at6ghy51.jpg,9,,2020-11-10 14:43
This is me every single day,374,https://i.redd.it/b2qj5wpvpqo51.jpg,4,,2020-09-22 12:12
Ours is better,372,https://i.redd.it/tequn90kc4q21.png,2,,2019-04-03 15:44
North Campus - with a film aesthetic📸,375,https://www.reddit.com/gallery/13e5r1u,16,,2023-05-10 16:40
Online Classes ruined me,375,https://v.redd.it/x3178oqu9e381,8,,2021-12-03 14:23
'Tis the Season,375,https://i.redd.it/7ll7scuta1761.jpg,5,,2020-12-23 18:03
Ok so being a fourth year and taking a first year class this semester as an elective had to be the worst decision ever,377,https://www.reddit.com/r/uAlberta/comments/iq9g2g/ok_so_being_a_fourth_year_and_taking_a_first_year/,46,"This isn't fucking highschool. Stop asking for people's instagrams, stop asking questions the prof just answered 2 minutes ago, stop having private conversations with your friends about how “fucked up” you got over the weekend after the prof has asked u to stop, stop spamming the zoom chat with useless garbage making it impossible for TAs to find valid questions. 
I never knew some people in uni were really this immature. Grow the fuck up. You're disrespecting the prof that is already dealing with a lot of stress managing a zoom lecture and the other students around you that are trying to learn. 
If u 17/18 year olds can't handle that then take a year off or go back to highschool.",2020-09-10 12:43
Congrats on making it to reading week frends! 👏,377,https://i.redd.it/xdml52eb56h61.jpg,4,,2021-02-12 21:01
I love having -2 minutes To scramble into the next zoom call,380,https://i.imgur.com/abzkIek.jpg,6,,2020-10-01 16:48
"Well folks, it's been a wild ride.",371,https://i.redd.it/llfm3oabhau41.png,19,,2020-04-21 21:32
UofA students walking through double doors be like,374,https://i.redd.it/1ipw7h0sn2s91.jpg,7,,2022-10-05 17:29
Big brain time,376,https://i.redd.it/k39ifkny5t451.jpg,11,,2020-06-13 23:03
👏CANCEL👏THE👏SEMESTER 👏,376,https://www.reddit.com/r/uAlberta/comments/fowleb/cancelthesemester/,50,Pls for the love of god just give me my CR and let me go deal with the disaster this pandemic has caused my family fml,2020-03-25 13:35
Would anyone like to join my discord server where we cheat on exams and commit Academic Fraud and Dishonesty?,370,https://www.reddit.com/r/uAlberta/comments/mbqwiu/would_anyone_like_to_join_my_discord_server_where/,27,"To gain access, please comment below. Make sure to include the following information:

* your full name
* your student ID number
* your uAlberta email
* your SIN number

Hurry! We're running out of spots.

Edit: for anyone looking for it, here's a [link to the server](https://bit.ly/2RaFSzp)",2021-03-23 16:42
planner.exe has stopped working...,372,https://i.redd.it/pyy368wo4db61.jpg,16,,2021-01-14 14:05
spam 😡,370,https://i.redd.it/e6sgygswfsf41.jpg,6,,2020-02-08 16:54
When your Upass is expired but the bus driver still lets you ride,372,https://i.redd.it/62bzytfghny21.png,20,,2019-05-16 16:35
Break got me like:,368,https://i.redd.it/bcslpzxsfj741.jpg,3,,2019-12-29 02:04
my only notable talent at this point,370,https://i.redd.it/663ukgreery31.jpg,4,,2019-11-14 19:13
Easter weekend vibes,371,https://i.redd.it/as5uk6pws2q61.jpg,7,,2021-03-29 20:23
I have to watch last week's lectures first,364,https://i.redd.it/40e34t44ten51.jpg,10,,2020-09-15 19:05
Adopted a cat yesterday instead of writing my essays and studying #ultimateprocrastination,371,https://i.redd.it/vk256i1seq041.jpg,22,,2019-11-24 18:02
It's even slower now,367,https://i.redd.it/v2xy7qixzjv61.png,6,,2021-04-26 11:34
"Reading week is 9 days away, just keep going",368,https://i.redd.it/l168lrzfqvv51.png,12,,2020-10-28 12:33
Finally my grades finally came in finally : ),365,https://i.redd.it/9xwivktp3nx41.png,9,,2020-05-08 19:12
TA appreciation post -My TA is heaven sent,365,https://i.redd.it/26s18ife39261.jpg,14,,2020-11-29 14:54
this is a strange feeling,368,https://i.redd.it/079h5hv49go41.jpg,9,,2020-03-23 10:32
Finally something professors and students agree on!,372,https://i.redd.it/o4zjsg64n1n41.jpg,9,,2020-03-16 08:19
We are 2 years into the pandemic & I still see some of y'all not washing your hands after using the washroom..,362,https://i.redd.it/njzuzqhv6vl81.jpg,37,,2022-03-06 18:29
Be careful guys srsly,365,https://www.reddit.com/r/uAlberta/comments/seyreb/be_careful_guys_srsly/,50,"Last night, at the LRT station, on my way to the hub, a woman punched my face for no reason. she bad-mouthed me and I accidentally made eye contact with her. And then this happened. There was no security guard at that time and I was so afraid. Also, I saw two tall guys doing drugs in the HUB stairway as well. I really feel unsafe in HUB and LRT. I hope the campus will take some action to solve this problem in HUB not only for students but for everyone using the campus facility.

Everyone please be careful and stay safe.",2022-01-28 12:35
It be like that,368,https://i.redd.it/zkotiju1znk31.jpg,7,,2019-09-04 17:44
When someone asks what I have planned for reading week,365,https://i.redd.it/yj4owsrb4yw51.jpg,4,,2020-11-02 20:39
CR/NCR,362,https://i.redd.it/8g4hc9mk0io41.jpg,7,,2020-03-23 16:27
We as students need to push to follow the University of Toronto's OPTIONAL CR/NCR grades policy,360,https://www.reddit.com/r/uAlberta/comments/fll1vq/we_as_students_need_to_push_to_follow_the/,136,"You can read about what the University of Toronto is doing [here](https://utsc.utoronto.ca/news-events/changes-drop-dates-and-crncr-options-students).

To summarize, students get to decide whether they want a letter grade or a CR/NCR (i.e. pass/fail) for EACH of their classes AFTER learning what their letter grade would be. This only gives you more freedom as a student, without any downsides to you.

- If you did well, you take the letter grade and boost your GPA.

- If you didn't do well, perhaps due to the current situation, then you take the CR, and your transcript isn't negatively affected.

- They also pushed their drop deadline all the way to April 25th, so if you think you're going to fail, you have until the last possible moment to drop the class. I'm not positive on how they are handling this, but you may be allowed to write your final first, too. So you'll have the opportunity to see how the online final is handled. If you didn't feel confident, and are afraid that you're going to fail, then you will still be allowed to drop the class.

This is the best option for ALL students and gives YOU the choice for how you want to handle this semester.

I don't see how anyone can argue against this option. 

WHY is the UofA choosing the option that penalizes high-achieving students? With what the UofA is proposing, all of your hard work will be for nothing, and any GPA-boosting classes that you took this semester were a complete waste (and you should have saved them for the future). If you were looking at this semester as a chance to work harder and improve, then it was all for naught, and you're stuck with the GPA you achieved in the last semester, so say goodbye to any scholarships, Dean's list, professional programs, etc. that you were working towards. Your 100% is now just as good as a 50%.

If anyone has suggestions on how we as students can organize and fight against this, please let us know. Can our Student's Union help us at all?

If you have experience with campus activism, are able to start a petition, etc. please let me know and I will add any info to this post.

Edit: 

- [You can read more about what the UofA is proposing here](https://www.ualberta.ca/governance/media-library/2020-03-19-exec-special-meeting-materials.pdf).

- [Here is a more recent University of Toronto page that mentions how students will be able to choose between a CR and a letter grade AFTER seeing what their letter grade would be.](https://www.artsci.utoronto.ca/covid19-artsci-student-faqs)

**[A petition has been started here.](http://chng.it/JMCwHcdfG5)**",2020-03-19 18:18
COVID-19,368,https://i.redd.it/enn4rr1fq5m41.jpg,8,,2020-03-11 21:01
Mood,362,https://i.redd.it/y9aky8knupi41.jpg,14,,2020-02-23 11:24
It be like that sometimes (all the time),365,https://i.redd.it/4fnr3w1mt5q31.jpg,6,,2019-10-02 11:06
Except I Can't go Back😔,367,https://i.redd.it/gmdpg4fvun561.jpg,6,,2020-12-16 19:45
cause it's midterm szn,364,https://i.redd.it/3ia3afedsle41.jpg,10,,2020-02-02 17:27
Bought snacks Thursday. Ran out Saturday,360,https://i.redd.it/blolnf28mtt61.png,10,,2021-04-17 17:47
When your final is still worth 50% of your grade,364,https://i.redd.it/d0qh1lsnx1p41.jpg,22,,2020-03-26 11:27
"if only grad/professional schools could see your guys' empathetic, selfless and considerate characteristics at this moments",360,https://www.reddit.com/r/uAlberta/comments/fm8n1c/if_only_gradprofessional_schools_could_see_your/,46,"University's admin are people as well, who, believe it or not, are going through the same extraordinary crisis as we all are right now. On top of caring for their families, kids, sick loved ones they also have to deal with a shitload of administrative issues for all of us ungrateful fucks who cannot take a second to think before sending aggressive emails or complaining about newly, well thought out, implemented decisions. The CR/NCR system is meant to be fair for *everyone*; if you introduce an opt out then that will create inequality, and those who choose to receive credits will have a semester looking worse compared to someone else's with grades.

Oh, what's that? You busted your ass for the past 3 months to *just receive credits* and you want a letter grade reflecting *all* of your hard work and dedication? Well guess what? Life is unfair and things will come crashing down at the most unexpected times and we all just have to learn to deal with it. With inevitable cheating and academic misconduct during online exams the uni has NO other choice. The grades you beg for wont accurately reflect your learning anyway in this situation with skewed averages AND even if you were to receive any grades for this semester, I doubt any uni would take them seriously.

May I remind you that the entire fucking planet is going through a pandemic and it's a shitty situation for EVERYONE, so rest assured, that any university you will apply to for your graduate program, will be aware of these dire circumstances.

*drops mic*",2020-03-20 21:32
Part 3,363,https://i.redd.it/8946q3ibdt841.png,5,,2020-01-04 12:32
juuust an fyi;),358,https://i.redd.it/8xqd1f9cz3o91.jpg,23,,2022-09-15 17:40
How's my schedule for Fall 2021? I'm going into Y3Q4 engineering,362,https://i.redd.it/e44x8aykibz61.png,14,,2021-05-15 11:20
POV: Youre a 1st year on day 3 of the semester. You haven't moved on from your high school days and want everyone to remember that you go to uni,360,https://i.redd.it/lq00mvc9wwr61.jpg,13,,2021-04-08 02:40
True that,358,https://i.imgur.com/ynaKHuJ.jpg,6,,2020-10-30 15:21
"Haha, I'm in danger. *(NCR inbound)",368,https://i.redd.it/jdrhad76b3r41.png,7,,2020-04-05 18:13
i believe in you!,361,https://i.redd.it/iaywc4ympog61.jpg,18,,2021-02-10 10:23
